mdrm,description
BHCK8566,DESCRIPTION OF THE SECOND COMPONENT OF OTHER NONINTEREST EXPENSE THAT EXCEED 10% OF OTHER NONINTEREST EXPENSE (4092)
BHCK8567,DESCRIPTION OF THE THIRD COMPONENT OF OTHER NONINTEREST EXPENSE THAT EXCEED 10% OF OTHER NONINTEREST EXPENSE (4092)
BHCK8693,INTEREST RATE FUTURES CONTRACTS
BHCK8694,FOREIGN EXCHANGE FUTURES CONTRACTS
BHCK8695,EQUITY DERIVATIVE FUTURES CONTRACTS
BHCK8696,COMMODITY AND OTHER FUTURES CONTRACTS
BHCK8697,INTEREST RATE FORWARD CONTRACTS
BHCK8698,FOREIGN EXCHANGE FORWARD CONTRACTS
BHCK8699,EQUITY DERIVATIVE FORWARD CONTRACTS
BHCK8700,COMMODITY AND OTHER FORWARD CONTRACTS
BHCK8701,WRITTEN EXCHANGE-TRADED INTEREST RATE OPTION CONTRACTS
BHCK8702,WRITTEN EXCHANGE-TRADED FOREIGN EXCHANGE OPTION CONTRACTS
BHCK8703,WRITTEN EXCHANGE-TRADED EQUITY DERIVATIVE OPTION CONTRACTS
BHCK8704,WRITTEN EXCHANGE-TRADED COMMODITY AND OTHER EXCHANGE-TRADED OPTION CONTRACTS
BHCK8705,PURCHASED EXCHANGE-TRADED INTEREST RATE OPTION CONTRACTS
BHCK8706,PURCHASED EXCHANGE-TRADED FOREIGN EXCHANGE OPTION CONTRACTS
BHCK8707,PURCHASED EXCHANGE-TRADED EQUITY DERIVATIVE OPTION CONTRACTS
BHCK8708,PURCHASED EXCHANGE-TRADED COMMODITY AND OTHER EXCHANGE-TRADED OPTION CONTRACTS
BHCK8709,WRITTEN OTC INTEREST RATE OPTION CONTRACTS
BHCK8710,WRITTEN OTC FOREIGN EXCHANGE OPTION CONTRACTS
BHCK8711,WRITTEN OTC EQUITY DERIVATIVE OPTION CONTRACTS
BHCK8712,WRITTEN OTC COMMODITY AND OTHER OTC OPTION CONTRACTS
BHCK8713,PURCHASED OTC INTEREST RATE OPTION CONTRACTS
BHCK8714,PURCHASED OTC FOREIGN EXCHANGE OPTION CONTRACTS
BHCK8715,PURCHASED OTC EQUITY DERIVATIVE OPTION CONTRACTS
BHCK8716,PURCHASED OTC COMMODITY AND OTHER OTC OPTION CONTRACTS
BHCK8717,TRILLION $ INDICATOR FOR ITEM A126
BHCK8718,TRILLION $ INDICATOR FOR ITEM A127
BHCK8719,EQUITY SWAPS
BHCK8720,COMMODITY AND OTHER SWAPS
BHCK8723,TOTAL GROSS NOTIONAL AMOUNT OF EQUITY DERIVATIVE CONTRACTS HELD FOR TRADING
BHCK8724,TOTAL GROSS NOTIONAL AMOUNT OF COMMODITY AND OTHER DERIVATIVE CONTRACTS HELD FOR TRADING
BHCK8725,TOTAL GROSS NOTIONAL AMOUNT OF INTEREST RATE DERIVATIVE CONTRACTS HELD FOR PURPOSES OTHER THAN TRADING: CONTRACTS MARKED TO MARKET
BHCK8726,TOTAL GROSS NOTIONAL AMOUNT OF FOREIGN EXCHANGE DERIVATIVE CONTRACTS HELD FOR PURPOSES OTHER THAN TRADING: CONTRACTS MARKED TO MARKET
BHCK8727,TOTAL GROSS NOTIONAL AMOUNT OF EQUITY DERIVATIVE CONTRACTS HELD FOR PURPOSES OTHER THAN TRADING: CONTRACTS MARKED TO MARKET
BHCK8728,TOTAL GROSS NOTIONAL AMOUNT OF COMMODITY AND OTHER DERIVATIVE CONTRACTS HELD FOR PURPOSES OTHER THAN TRADING: CONTRACTS MARKED TO MARKET
BHCK8729,TOTAL GROSS NOTIONAL AMOUNT OF INTEREST RATE DERIVATIVE CONTRACTS HELD FOR PURPOSES OTHER THAN TRADING: CONTRACTS NOT MARKED TO MARKET
BHCK8730,TOTAL GROSS NOTIONAL AMOUNT OF FOREIGN EXCHANGE DERIVATIVE CONTRACTS HELD FOR PURPOSES OTHER THAN TRADING: CONTRACTS NOT MARKED TO MARKET
BHCK8731,TOTAL GROSS NOTIONAL AMOUNT OF EQUITY DERIVATIVE CONTRACTS HELD FOR PURPOSES OTHER THAN TRADING: CONTRACTS NOT MARKED TO MARKET
BHCK8732,TOTAL GROSS NOTIONAL AMOUNT OF COMMODITY AND OTHER DERIVATIVE CONTRACTS HELD FOR PURPOSES OTHER THAN TRADING: CONTRACTS NOT MARKED TO MARKET
BHCK8733,GROSS POSITIVE FAIR VALUE OF INTEREST RATE DERIVATIVE CONTRACTS HELD FOR TRADING
BHCK8734,GROSS POSITIVE FAIR VALUE OF FOREIGN EXCHANGE DERIVATIVE CONTRACTS HELD FOR TRADING
BHCK8735,GROSS POSITIVE FAIR VALUE OF EQUITY DERIVATIVE CONTRACTS HELD FOR TRADING
BHCK8736,GROSS POSITIVE FAIR VALUE OF COMMODITY AND OTHER DERIVATIVE CONTRACTS HELD FOR TRADING
BHCK8737,GROSS NEGATIVE FAIR VALUE OF INTEREST RATE DERIVATIVE CONTRACTS HELD FOR TRADING
BHCK8738,GROSS NEGATIVE FAIR VALUE OF FOREIGN EXCHANGE DERIVATIVE CONTRACTS HELD FOR TRADING
BHCK8739,GROSS NEGATIVE FAIR VALUE OF EQUITY DERIVATIVE CONTRACTS HELD FOR TRADING
BHCK8740,GROSS NEGATIVE FAIR VALUE OF COMMODITY AND OTHER DERIVATIVE CONTRACTS HELD FOR TRADING
BHCK8741,GROSS POSITIVE FAIR VALUE OF INTEREST RATE DERIVATIVE CONTRACTS HELD FOR PURPOSES OTHER THAN TRADING THAT ARE MARKED TO MARKET
BHCK8742,GROSS POSITIVE FAIR VALUE OF FOREIGN EXCHANGE DERIVATIVE CONTRACTS HELD FOR PURPOSES OTHER THAN TRADING THAT ARE MARKED TO MARKET
BHCK8743,GROSS POSITIVE FAIR VALUE OF EQUITY DERIVATIVE CONTRACTS HELD FOR PURPOSES OTHER THAN TRADING THAT ARE MARKED TO MARKET
BHCK8744,GROSS POSITIVE FAIR VALUE OF COMMODITY AND OTHER DERIVATIVE CONTRACTS HELD FOR PURPOSES OTHER THAN TRADING THAT ARE MARKED TO MARKET
BHCK8745,GROSS NEGATIVE FAIR VALUE OF INTEREST RATE DERIVATIVE CONTRACTS HELD FOR PURPOSES OTHER THAN TRADING THAT ARE MARKED TO MARKET
BHCK8746,GROSS NEGATIVE FAIR VALUE OF FOREIGN EXCHANGE DERIVATIVE CONTRACTS HELD FOR PURPOSES OTHER THAN TRADING THAT ARE MARKED TO MARKET
BHCK8747,GROSS NEGATIVE FAIR VALUE OF EQUITY DERIVATIVE CONTRACTS HELD FOR PURPOSES OTHER THAN TRADING THAT ARE MARKED TO MARKET
BHCK8748,GROSS NEGATIVE FAIR VALUE OF COMMODITY AND OTHER DERIVATIVE CONTRACTS HELD FOR PURPOSES OTHER THAN TRADING THAT ARE MARKED TO MARKET
BHCK8749,GROSS POSITIVE FAIR VALUE OF INTEREST RATE DERIVATIVE CONTRACTS HELD FOR PURPOSES OTHER THAN TRADING THAT ARE NOT MARKED TO MARKET
BHCK8750,GROSS POSITIVE FAIR VALUE OF FOREIGN EXCHANGE DERIVATIVE CONTRACTS HELD FOR PURPOSES OTHER THAN TRADING THAT ARE NOT MARKED TO MARKET
BHCK8751,GROSS POSITIVE FAIR VALUE OF EQUITY DERIVATIVE CONTRACTS HELD FOR PURPOSES OTHER THAN TRADING THAT ARE NOT MARKED TO MARKET
BHCK8752,GROSS POSITIVE FAIR VALUE OF COMMODITY AND OTHER DERIVATIVE CONTRACTS HELD FOR PURPOSES OTHER THAN TRADING THAT ARE NOT MARKED TO MARKET
BHCK8753,GROSS NEGATIVE FAIR VALUE OF INTEREST RATE DERIVATIVE CONTRACTS HELD FOR PURPOSES OTHER THAN TRADING THAT ARE NOT MARKED TO MARKET
BHCK8754,GROSS NEGATIVE FAIR VALUE OF FOREIGN EXCHANGE DERIVATIVE CONTRACTS HELD FOR PURPOSES OTHER THAN TRADING THAT ARE NOT MARKED TO MARKET
BHCK8755,GROSS NEGATIVE FAIR VALUE OF EQUITY DERIVATIVE CONTRACTS HELD FOR PURPOSES OTHER THAN TRADING THAT ARE NOT MARKED TO MARKET
BHCK8756,GROSS NEGATIVE FAIR VALUE OF COMMODITY AND OTHER DERIVATIVE CONTRACTS HELD FOR PURPOSES OTHER THAN TRADING THAT ARE NOT MARKED TO MARKET
BHCK8757,INTEREST RATE EXPOSURES
BHCK8758,FOREIGN EXCHANGE EXPOSURES
BHCK8759,EQUITY SECURITY OR INDEX EXPOSURES
BHCK8760,COMMODITY AND OTHER EXPOSURES
BHCK8761,NET INCREASE (DECREASE) TO INTEREST INCOME
BHCK8762,NET (INCREASE) DECREASE TO INTEREST EXPENSE
BHCK8763,OTHER (NONINTEREST) ALLOCATIONS
BHCK8764,CURRENT CREDIT EXPOSURE ACROSS ALL OFF-BALANCE SHEET DERIVATIVE CONTRACTS COVERED BY THE RISK-BASED CAPITAL STANDARDS
BHCK8765,SPOT FOREIGN EXCHANGE CONTRACTS
BHCK8766,NOTIONAL PRINCIPAL AMOUNT OF INTEREST RATE CONTRACTS WITH A REMAINING MATURITY OF OVER ONE YEAR THROUGH FIVE YEARS
BHCK8767,NOTIONAL PRINCIPAL AMOUNT OF INTEREST RATE CONTRACTS WITH A REMAINING MATURITY OF OVER FIVE YEARS
BHCK8768,TRILLION $ INDICATOR FOR ITEM 3826
BHCK8769,NOTIONAL PRINCIPAL AMOUNT OF FOREIGN EXCHANGE CONTRACTS WITH A REMAINING MATURITY OF OVER ONE YEAR THROUGH FIVE YEARS
BHCK8770,NOTIONAL PRINCIPAL AMOUNT OF FOREIGN EXCHANGE CONTRACTS WITH A REMAINING MATURITY OF OVER FIVE YEARS
BHCK8771,NOTIONAL PRINCIPAL AMOUNT OF GOLD CONTRACTS WITH A REMAINING MATURITY OF ONE YEAR OR LESS
BHCK8772,NOTIONAL PRINCIPAL AMOUNT OF GOLD CONTRACTS WITH A REMAINING MATURITY OF OVER ONE YEAR THROUGH FIVE YEARS
BHCK8773,NOTIONAL PRINCIPAL AMOUNT OF GOLD CONTRACTS WITH A REMAINING MATURITY OF OVER FIVE YEARS
BHCK8774,NOTIONAL PRINCIPAL AMOUNT OF OTHER PRECIOUS METALS CONTRACTS WITH A REMAINING MATURITY OF ONE YEAR OR LESS
BHCK8775,NOTIONAL PRINCIPAL AMOUNT OF OTHER PRECIOUS METALS CONTRACTS WITH A REMAINING MATURITY OF OVER ONE YEAR THROUGH FIVE YEARS
BHCK8776,NOTIONAL PRINCIPAL AMOUNT OF OTHER PRECIOUS METALS CONTRACTS WITH A REMAINING MATURITY OF OVER FIVE YEARS
BHCK8777,NOTIONAL PRINCIPAL AMOUNT OF OTHER COMMODITY CONTRACTS WITH A REMAINING MATURITY OF ONE YEAR OR LESS
BHCK8778,NOTIONAL PRINCIPAL AMOUNT OF OTHER COMMODITY CONTRACTS WITH A REMAINING MATURITY OF OVER ONE YEAR THROUGH FIVE YEARS
BHCK8779,NOTIONAL PRINCIPAL AMOUNT OF OTHER COMMODITY CONTRACTS WITH A REMAINING MATURITY OF OVER FIVE YEARS
BHCK8780,AMORTIZED COST OF HIGH-RISK MORTGAGE SECURITIES
BHCK8781,FAIR VALUE OF HIGH-RISK MORTGAGE SECURITIES
BHCK8782,AMORTIZED COST OF STRUCTURED NOTES
BHCK8783,FAIR VALUE OF STRUCTURED NOTES
BHCK8784,SALES OF PROPRIETARY MUTUAL FUNDS AND ANNUITIES
BHCK8798,FDR TIME STAMP
BHCK8799,ARCHIVAL DATE STAMP
BHCK8831,TRILLION $ INDICATOR FOR ITEM 3823
BHCK8832,TRILLION $ INDICATOR FOR ITEM 3824
BHCK8833,TRILLION $ INDICATOR FOR ITEM 3825
BHCK8834,TRILLION $ INDICATOR
BHCK8835,TRILLION $ INDICATOR FOR ITEM 3415
BHCK8836,TRILLION $ INDICATOR FOR ITEM 3809
BHCK8837,TRILLION $ INDICATOR FOR ITEM 3810
BHCK8838,TRILLION $ INDICATOR FOR ITEM 3812
BHCK8839,TRILLION $ INDICATOR FOR ITEM 6625
BHCK8840,TRILLION $ INDICATOR FOR ITEM 6626
BHCK8841,TRILLION $ INDICATOR FOR ITEM 6716
BHCK8843,ESTIMATION FLAG
BHCK8899,DATA TRANSMISSION ITEM
BHCK8902,AREA CODE/PHONE NUMBER OF PERSON WHOM QUESTIONS ABOUT THIS REPORT SHOULD BE DIRECTED
BHCK9191,PROCESSING DISTRICT
BHCK9802,SUBSIDIARY FLAG (SUB FLAG)
BHCKA000,NOTIONAL PRINCIPAL AMOUNT OF EQUITY DERIVATIVE CONTRACTS WITH A REMAINING MATURITY OF ONE YEAR OR LESS
BHCKA001,NOTIONAL PRINCIPAL AMOUNT OF EQUITY DERIVATIVE CONTRACTS WITH A REMAINING MATURITY OF OVER ONE YEAR THROUGH FIVE YEARS
BHCKA002,NOTIONAL PRINCIPAL AMOUNT OF EQUITY DERIVATIVE CONTRACTS WITH A REMAINING MATURITY OF OVER FIVE YEARS
BHCKA102,TOTAL GROSS REDEMPTIONS OF MUTUAL FUNDS AND ANNUITIES
BHCKA103,CURRENT CREDIT EXPOSURE ACROSS ALL OFF-BALANCE SHEET DERIVATIVE CONTRACTS COVERED BY THE RISK-BASED CAPITAL STANDARDS
BHCKA104,NOTIONAL PRINCIPAL AMOUNT OF INTEREST RATE CONTRACTS WITH A REMAINING MATURITY OF OVER ONE YEAR THROUGH FIVE YEARS
BHCKA105,NOTIONAL PRINCIPAL AMOUNT OF INTEREST RATE CONTRACTS WITH A REMAINING MATURITY OF OVER FIVE YEARS
BHCKA106,NOTIONAL PRINCIPAL AMOUNT OF FOREIGN EXCHANGE CONTRACTS WITH A REMAINING MATURITY OF OVER ONE YEAR THROUGH FIVE YEARS
BHCKA107,NOTIONAL PRINCIPAL AMOUNT OF FOREIGN EXCHANGE CONTRACTS WITH A REMAINING MATURITY OF OVER FIVE YEARS
BHCKA108,NOTIONAL PRINCIPAL AMOUNT OF GOLD CONTRACTS WITH A REMAINING MATURITY OF ONE YEAR OR LESS
BHCKA109,NOTIONAL PRINCIPAL AMOUNT OF GOLD CONTRACTS WITH A REMAINING MATURITY OF OVER ONE YEAR THROUGH FIVE YEARS
BHCKA110,NOTIONAL PRINCIPAL AMOUNT OF GOLD CONTRACTS WITH A REMAINING MATURITY OF OVER FIVE YEARS
BHCKA111,NOTIONAL PRINCIPAL AMOUNT OF OTHER PRECIOUS METALS CONTRACTS WITH A REMAINING MATURITY OF ONE YEAR OR LESS
BHCKA112,NOTIONAL PRINCIPAL AMOUNT OF OTHER PRECIOUS METALS CONTRACTS WITH A REMAINING MATURITY OF OVER ONE YEAR THROUGH FIVE YEARS
BHCKA113,NOTIONAL PRINCIPAL AMOUNT OF OTHER PRECIOUS METALS CONTRACTS WITH A REMAINING MATURITY OF OVER FIVE YEARS
BHCKA114,NOTIONAL PRINCIPAL AMOUNT OF OTHER COMMODITY CONTRACTS WITH A REMAINING MATURITY OF ONE YEAR OR LESS
BHCKA115,NOTIONAL PRINCIPAL AMOUNT OF OTHER COMMODITY CONTRACTS WITH A REMAINING MATURITY OF OVER ONE YEAR THROUGH FIVE YEARS
BHCKA116,NOTIONAL PRINCIPAL AMOUNT OF OTHER COMMODITY CONTRACTS WITH A REMAINING MATURITY OF OVER FIVE YEARS
BHCKA117,NOTIONAL PRINCIPAL AMOUNT OF EQUITY DERIVATIVE CONTRACTS WITH A REMAINING MATURITY OF ONE YEAR OR LESS
BHCKA118,NOTIONAL PRINCIPAL AMOUNT OF EQUITY DERIVATIVE CONTRACTS WITH A REMAINING MATURITY OF OVER ONE YEAR THROUGH FIVE YEARS
BHCKA119,NOTIONAL PRINCIPAL AMOUNT OF EQUITY DERIVATIVE CONTRACTS WITH A REMAINING MATURITY OF OVER FIVE YEARS
BHCKA120,TRILLION $ INDICATOR FOR ITEM 8765
BHCKA121,TRILLION $ INDICATOR FOR ITEM 8693
BHCKA122,TRILLION $ INDICATOR FOR ITEM 8694
BHCKA123,TRILLION $ INDICATOR FOR ITEM 8697
BHCKA124,TRILLION $ INDICATOR FOR ITEM 8698
BHCKA126,TOTAL GROSS NOTIONAL AMOUNT OF INTEREST RATE DERIVATIVE CONTRACTS HELD FOR TRADING
BHCKA127,TOTAL GROSS NOTIONAL AMOUNT OF FOREIGN EXCHANGE DERIVATIVE CONTRACTS HELD FOR TRADING
BHCKA128,TRILLION $ INDICATOR FOR ITEM 8766
BHCKA129,TRILLION $ INDICATOR FOR ITEM A104
BHCKA130,OTHER COMPONENTS OF EQUITY CAPITAL
BHCKA195,TOTAL PERPETUAL DEBT; UNDEDICATED PORTIONS OF MANDATORY CONVERTIBLE SECURITIES (INCLUDED IN SCHEDULE HC; ITEMS 20.A AND 2.B) AND LONG-TERM PREFERRED STOCK WITH AN ORIGINAL MATURITY OF 20 YEARS OR MORE THAT QUALIFY FOR SUPPLEMENTARY CAPITAL (AFTER DISCOUNTING)
BHCKA196,RISK-WEIGHTED ASSETS (NET OF ALLOWANCES AND OTHER DEDUCTIONS)
BHCKA220,TRADING REVENUE
BHCKA221,NET UNREALIZED LOSS ON AVAILABLE-FOR-SALE EQUITY SECURITIES
BHCKA222,EXCESS ALLOWANCE FOR LOAN AND LEASE LOSSES
BHCKA223,RISK-WEIGHTED ASSETS (NET OF ALLOWANCES AND OTHER DEDUCTIONS)
BHCKA224,AVERAGE TOTAL ASSETS (NET OF DEDUCTIONS)
BHCKA249,OUTSTANDING PRINCIPAL BALANCE OF SMALL BUSINESS OBLIGATIONS TRANSFERRED AS OF THE REPORT DATE
BHCKA250,AMOUNT OF RETAINED RECOURSE ON THESE OBLIGATIONS (SBOS) AS OF THE REPORT DATE
BHCKA251,CREDIT LOSSES ON OFF-BALANCE SHEET DERIVATIVES
BHCKA288,SECURITIES PURCHASE UNDER AGREEMENTS TO RESELL NETTED AGAINST SECURITIES SOLD UNDER AGREEMENTS TO REPURCHASE
BHCKA506,INTERMEDIATE PREFERRED STOCK WITH AN ORIGINAL WEIGHTED AVERAGE MATURITY OF 5 YEARS OR MORE; SUBORDINATED DEBT WITH AN ORIGINAL WEIGHTED AVERAGE MATURITY OF 5 YEARS OR MORE; OR UNSECURED LONG-TERM DEBT ISSUED BY THE BANK HOLDING COMPANY PRIOR TO MARCH 12; 1988; THAT QUALIFIED AS SECONDARY CAPITAL (AFTER DISCOUNTING)
BHCKA507,OTHER CUMULATIVE PREFERRED STOCK ELIGIBLE FOR INCLUSION IN TIER 1 CAPITAL (E.G. TRUST PREFERRED SECURITIES)
BHCKA508,TIER 1 CAPITAL
BHCKA509,TOTAL RISK-BASED CAPITAL
BHCKA510,AMORTIZED COST OF AVAILABLE-FOR-SALE INVESTMENTS IN MUTUAL FUNDS AND OTHER EQUITY SECURITIES WITH READILY DETERMINABLE FAIR VALUES
BHCKA511,FAIR VALUE OF AVAILABLE-FOR-SALE INVESTMENTS IN MUTUAL FUNDS AND OTHER EQUITY SECURITIES WITH READILY DETERMINABLE FAIR VALUES
BHCKA512,AGGREGATE ALLOWANCE FOR LOAN AND LEASE LOSSES - BALANCE AT END OF CURRENT PERIOD
BHCKA517,INTEREST ON TIME DEPOSITS OF $100;000 OR MORE
BHCKA518,INTEREST ON TIME DEPOSITS OF LESS THAN $100;000
BHCKA519,INTEREST-ONLY STRIPS RECEIVABLE (NOT IN THE FORM OF A SECURITY) ON MORTGAGE LOANS
BHCKA520,INTEREST-ONLY STRIPS RECEIVABLE (NOT IN THE FORM OF A SECURITY) ON OTHER FINANCIAL ASSETS
BHCKA521,FIRST LIEN 1-TO-4 FAMILY RESIDENTIAL MORTGAGE LOANS: OUTSTANDING PRINCIPAL BALANCE OF MORTGAGES TRANSFERRED AS OF THE REPORT DATE
BHCKA522,FIRST LIEN 1-TO-4 FAMILY RESIDENTIAL MORTGAGE LOANS: AMOUNT OF RECOURSE EXPOSURE ON THESE MORTGAGES AS OF THE REPORT DATE
BHCKA523,OTHER FINANCIAL ASSETS: OUTSTANDING PRINCIPAL BALANCE OF ASSETS TRANSFERRED AS OF THE REPORT DATE
BHCKA524,OTHER FINANCIAL ASSETS: AMOUNT OF RECOURSE EXPOSURE ON THESE ASSETS AS OF THE REPORT DATE
BHCKA525,NET UNAMORTIZED REALIZED DEFERRED GAINS (LOSSES) ON OFF-BALANCE SHEET DERIVATIVE CONTRACTS INCLUDED IN ASSETS AND LIABILITIES REPORTED IN SCHEDULE RC
BHCKA530,DOES THE REPORTING BANK HAVE A SUBCHAPTER S ELECTION IN EFFECT FOR FEDERAL INCOME TAX PURPOSES FOR THE CURRENT TAX YEAR?
BHCKA534,CREDIT DERIVATIVES ON WHICH THE REPORTING BANK IS THE GUARANTOR
BHCKA535,CREDIT DERIVATIVES ON WHICH THE REPORTING BANK IS THE BENEFICIARY
BHCKA591,OUTSTANDING PRINCIPAL BALANCE OF LOANS OTHER THAN 1-4 FAMILY RESIDENTIAL MORTGAGE LOANS THAT ARE SERVICED FOR OTHERS
BHCKB024,TRILLION DOLLAR INDICATOR FOR ITEM 8709
BHCKB025,TRILLION DOLLAR INDICATOR FOR ITEM 8713
BHCKB026,Balance Sheet Worksheet - Fair Value Adjustments - Assets: Intangibles: Purchased Credit Card Relationships and Nonmortgage Servicing Rights
BHCKB027,SIXTH TEXT OF NOTES TO ITEMS ON BALANCE SHEET
BHCKB028,SEVENTH TEXT OF NOTES TO ITEMS ON BALANCE SHEET
BHCKB029,EIGHTH TEXT OF NOTES TO ITEMS ON BALANCE SHEET
BHCKB030,NINTH TEXT OF NOTES TO ITEMS ON BALANCE SHEET
BHCKB031,TENTH TEXT OF NOTES TO ITEMS ON BALANCE SHEET
BHCKB032,ELEVENTH TEXT OF NOTES TO ITEMS ON BALANCE SHEET
BHCKB033,TWELFTH TEXT OF NOTES TO ITEMS ON BALANCE SHEET
BHCKB034,THIRTEENTH TEXT OF NOTES TO ITEMS ON BALANCE SHEET
BHCKB035,FOURTEENTH TEXT OF NOTES TO ITEMS ON BALANCE SHEET
BHCKB036,FIFTEENTH TEXT OF NOTES TO ITEMS ON BALANCE SHEET
BHCKB037,SIXTEENTH TEXT OF NOTES TO ITEMS ON BALANCE SHEET
BHCKB038,SEVENTEENTH TEXT OF NOTES TO ITEMS ON BALANCE SHEET
BHCKB039,EIGHTEENTH TEXT OF NOTES TO ITEMS ON BALANCE SHEET
BHCKB040,NINETEENTH TEXT OF NOTES TO ITEMS ON BALANCE SHEET
BHCKB041,TWENTIETH TEXT OF NOTES TO ITEMS ON BALANCE SHEET
BHCKB042,SIXTH TEXT OF NOTES TO ITEMS ON INCOME STATEMENT
BHCKB043,SEVENTH TEXT OF NOTES TO ITEMS ON INCOME STATEMENT
BHCKB044,EIGHTH TEXT OF NOTES TO ITEMS ON INCOME STATEMENT
BHCKB045,NINTH TEXT OF NOTES TO ITEMS ON INCOME STATEMENT
BHCKB046,TENTH TEXT OF NOTES TO ITEMS ON INCOME STATEMENT
BHCKB047,ELEVENTH TEXT OF NOTES TO ITEMS ON INCOME STATEMENT
BHCKB048,TWELFTH TEXT OF NOTES TO ITEMS ON INCOME STATEMENT
BHCKB049,THIRTEENTH TEXT OF NOTES TO ITEMS ON INCOME STATEMENT
BHCKB050,FOURTEENTH TEXT OF NOTES TO ITEMS ON INCOME STATEMENT
BHCKB051,FIFTEENTH TEXT OF NOTES TO ITEMS ON INCOME STATEMENT
BHCKB052,SIXTEENTH TEXT OF NOTES TO ITEMS ON INCOME STATEMENT
BHCKB053,SEVENTEENTH TEXT OF NOTES TO ITEMS ON INCOME STATEMENT
BHCKB054,EIGHTEENTH TEXT OF NOTES TO ITEMS ON INCOME STATEMENT
BHCKB055,NINETEENTH TEXT OF NOTES TO ITEMS ON INCOME STATEMENT
BHCKB056,TWENTIETH TEXT OF NOTES TO ITEMS ON INCOME STATEMENT
BHCKB077,FAIR MARKET VALUE OF PURCHASED CREDIT CARD RELATIONSHIPS AND NONMORTGAGE SERVICING ASSETS
BHCKB488,INTEREST AND DIVIDEND INCOME ON SECURITIES: U.S. TREASURY SECURITIES AND U.S. GOVERNMENT AGENCY OBLIGATIONS (EXCLUDING MORTGAGE-BACKED SECURITIES)
BHCKB489,INTEREST AND DIVIDEND INCOME ON SECURITIES: MORTGAGE-BACKED SECURITIES
BHCKB490,INVESTMENT BANKING; ADVISORY; BROKERAGE; AND UNDERWRITING FEES AND COMMISSIONS
BHCKB491,VENTURE CAPITAL REVENUE
BHCKB492,NET SERVICING FEES
BHCKB493,NET SECURITIZATION INCOME
BHCKB494,INSURANCE COMMISSIONS AND FEES
BHCKB496,NET GAINS (LOSSES) ON SALES OF OTHER ASSETS (EXCLUDING SECURITIES)
BHCKB497,OTHER NONINTEREST INCOME
BHCKB500,AMOUNT OF OWNERSHIP (OR SELLER'S) INTERESTS CARRIED AS: LOANS - HOME EQUITY LINES
BHCKB501,AMOUNT OF OWNERSHIP (OR SELLER'S) INTERESTS CARRIED AS: LOANS - CREDIT CARD RECEIVABLES
BHCKB502,AMOUNT OF OWNERSHIP (OR SELLER'S) INTEREST CARRIED AS: LOANS - COMMERCIAL & INDUSTRIAL LOANS
BHCKB507,RESTATEMENTS DUE TO CORRECTIONS OF MATERIAL ACCOUNTING ERRORS AND CHANGES IN ACCOUNTING PRINCIPLES
BHCKB508,BALANCE END OF PREVIOUS CALENDAR YEAR AS RESTATED
BHCKB511,OTHER COMPREHENSIVE INCOME
BHCKB512,CHARGE-OFFS LOANS IN FOREIGN OFFICES
BHCKB513,RECOVERIES ON LOANS IN FOREIGN OFFICES
BHCKB514,CHARGE-OFFS ON LOANS TO CREDIT CARDS
BHCKB515,RECOVERIES ON LOANS TO CREDIT CARDS
BHCKB516,CHARGE-OFF ON LOANS - OTHER
BHCKB517,RECOVERIES ON LOANS - OTHER
BHCKB521,TRILLION DOLLAR INDICATOR
BHCKB522,BALANCE MOST RECENTLY REPORTED FOR THE DECEMBER 31; 2000; REPORTS OF CONDITION AND INCOME(I.E.; AFTER ADJUSTMENTS FROM AMENDED REPORT OF INCOME)
BHCKB528,LOANS AND LEASES; NET OF UNEARNED INCOME - TOTALS
BHCKB529,LOANS AND LEASES; NET OF UNEARNED INCOME AND ALLOWANCE
BHCKB530,ACCUMULATED OTHER COMPREHENSIVE INCOME
BHCKB538,LOANS TO INDIVIDUALS FOR HOUSEHOLD; FAMILY; AND OTHER PERSONAL EXPENDITURES (I.E.; CONSUMER LOANS)(INCLUDES PURCHASED PAPER): CREDIT CARDS
BHCKB539,LOANS TO INDIVIDUALS FOR HOUSEHOLD; FAMILY; AND OTHER PERSONAL EXPENDITURES (I.E.; CONSUMER LOANS)(INCLUDES PURCHASED PAPER): OTHER REVOLVING CREDIT PLANS
BHCKB541,RECOURSE AND DIRECT CREDIT SUBSTITUTES (OTHER THAN FINANCIAL STANDBY LETTERS OF CREDIT) SUBJECT TO THE LOW-LEVEL EXPOSURE RULE AND RESIDUAL INTERESTS SUBJECT TO A DOLLAR-FOR-DOLLAR CAPITAL REQUIREMENT-FACE VALUE OR NOTIONAL AMOUNT
BHCKB545,TRILLION DOLLAR INDICATOR
BHCKB546,FINANCIAL STANDBY LETTERS OF CREDIT - FACE VALUE OR NOTIONAL AMOUNT
BHCKB556,ACCRUED INTEREST RECEIVABLE
BHCKB557,ALLOWANCE FOR CREDIT LOSSES ON OFF-BALANCE SHEET CREDIT EXPOSURES
BHCKB558,U.S. TREASURY SECURITIES AND U.S. GOVERNMENT AGENCY OBLIGATIONS (EXCLUDING MORTGAGE-BACKED SECURITIES)
BHCKB559,MORTGAGE-BACKED SECURITIES
BHCKB560,ALL OTHER SECURITIES
BHCKB569,DOES THE REPORTING BANK SELL PRIVATE LABEL OR THIRD PARTY MUTUAL FUNDS AND ANNUITIES? YES/NO
BHCKB570,ASSETS UNDER THE REPORTING BANK'S MANAGEMENT IN PROPRIETARY MUTUAL FUNDS AND ANNUITIES
BHCKB572,LOANS SECURED BY REAL ESTATE: IN FOREIGN OFFICES - PAST DUE 30 THROUGH 89 DAYS AND STILL ACCRUING
BHCKB573,LOANS SECURED BY REAL ESTATE: IN FOREIGN OFFICES - PAST DUE 90 DAYS OR MORE AND STILL ACCRUING
BHCKB574,LOANS SECURED BY REAL ESTATE: IN FOREIGN OFFICES - NONACCRUAL
BHCKB575,LOANS TO INDIVIDUALS FOR HOUSEHOLD; FAMILY; AND OTHER PERSONAL EXPENDITURES: CREDIT CARDS - PAST DUE 30 THROUGH 89 DAYS AND STILL ACCRUING
BHCKB576,LOANS TO INDIVIDUALS FOR HOUSEHOLD; FAMILY; AND OTHER PERSONAL EXPENDITURES: CREDIT CARDS - PAST DUE 90 DAYS OR MORE AND STILL ACCRUING
BHCKB577,LOANS TO INDIVIDUALS FOR HOUSEHOLD; FAMILY; AND OTHER PERSONAL EXPENDITURES: CREDIT CARDS - NONACCRUAL
BHCKB578,LOANS TO INDIVIDUALS FOR HOUSEHOLD; FAMILY; AND OTHER PERSONAL EXPENDITURES: OTHER - PAST DUE 30 THROUGH 89 DAYS AND STILL ACCRUING
BHCKB579,LOANS TO INDIVIDUALS FOR HOUSEHOLD; FAMILY; AND OTHER PERSONAL EXPENDITURES: OTHER - PAST DUE 90 DAYS OR MORE AND STILL ACCRUING
BHCKB580,LOANS TO INDIVIDUALS FOR HOUSEHOLD; FAMILY; AND OTHER PERSONAL EXPENDITURES: OTHER - NONACCRUAL
BHCKB588,LESS: NONQUALIFYING PERPETUAL PREFERRED STOCK
BHCKB589,QUALIFYING MINORITY INTERESTS IN CONSOLIDATED SUBSIDIARIES
BHCKB590,LESS: DISALLOWED GOODWILL AND OTHER DISALLOWED INTANGIBLE ASSETS
BHCKB591,LESS: DISALLOWED SERVICING ASSETS AND PURCHASED CREDIT CARD RELATIONSHIPS
BHCKB592,OTHER ADDITIONS TO (DEDUCTIONS FROM) TIER 1 CAPITAL
BHCKB593,CUMULATIVE PERPETUAL PREFERRED STOCK INCLUDIBLE IN TIER 2 CAPITAL
BHCKB594,OTHER TIER 2 CAPITAL COMPONENTS
BHCKB595,LESS: DEDUCTIONS FOR TOTAL RISK-BASED CAPITAL
BHCKB596,LESS:OTHER DEDUCTIONS FROM ASSETS FOR LEVERAGE CAPITAL PURPOSES
BHCKB639,OTHER ASSETS - TOTALS
BHCKB675,ALL OTHER FINANCIAL ASSETS SOLD WITH RECOURSE
BHCKB681,ALL OTHER OFF-BALANCE SHEET LIABILITIES
BHCKB696,TOTAL ASSETS; DERIVATIVES; AND OFF-BALANCE SHEET ITEMS BY RISK WEIGHT CATEGORY - 0%
BHCKB697,TOTAL ASSETS; DERIVATIVES; AND OFF-BALANCE SHEET ITEMS BY RISK WEIGHT CATEGORY - 20%
BHCKB698,TOTAL ASSETS; DERIVATIVES; AND OFF-BALANCE SHEET ITEMS BY RISK WEIGHT CATEGORY - 50%
BHCKB699,TOTAL ASSETS; DERIVATIVES; AND OFF-BALANCE SHEET ITEMS BY RISK WEIGHT CATEGORY - 100%
BHCKB700,RISK-WEIGHTED ASSETS BY RISK WEIGHT CATEGORY - 0%
BHCKB701,RISK-WEIGHTED ASSETS BY RISK WEIGHT CATEGORY - 20%
BHCKB702,RISK-WEIGHTED ASSETS BY RISK WEIGHT CATEGORY - 50%
BHCKB703,RISK-WEIGHTED ASSETS BY RISK WEIGHT CATEGORY - 100%
BHCKB704,RISK-WEIGHTED ASSETS BEFORE DEDUCTIONS FOR EXCESS ALLOWANCE FOR LOAN AND LEASE LOSSES AND ALLOCATED TRANSFER RISK RESERVE - 100%
BHCKB705,OUTSTANDING PRINCIPAL BALANCE OF ASSETS SOLD AND SECURITIZED WITH RECOURSE OR OTHER SELLER-PROVIDED CREDIT ENHANCEMENTS - 1-4 FAMILY RESIDENTIAL LOANS
BHCKB706,OUTSTANDING PRINCIPAL BALANCE OF ASSETS SOLD AND SECURITIZED WITH RECOURSE OR OTHER SELLER-PROVIDED CREDIT ENHANCEMENTS - HOME EQUITY LINES
BHCKB707,OUTSTANDING PRINCIPAL BALANCE OF ASSETS SOLD AND SECURITIZED WITH RECOURSE OR OTHER SELLER-PROVIDED CREDIT ENHANCEMENTS - CREDIT CARD RECEIVABLES
BHCKB708,OUTSTANDING PRINCIPAL BALANCE OF ASSETS SOLD AND SECURITIZED WITH RECOURSE OR OTHER SELLER-PROVIDED CREDIT ENHANCEMENTS - AUTO LOANS
BHCKB709,OUTSTANDING PRINCIPAL BALANCE OF ASSETS SOLD AND SECURITIZED WITH RECOURSE OR OTHER SELLER-PROVIDED CREDIT ENHANCEMENTS - OTHER CONSUMER LOANS
BHCKB710,OUTSTANDING PRINCIPAL BALANCE OF ASSETS SOLD AND SECURITIZED WITH RECOURSE OR OTHER SELLER-PROVIDED CREDIT ENHANCEMENTS - COMMERCIAL AND INDUSTRIAL LOANS
BHCKB711,OUTSTANDING PRINCIPAL BALANCE OF ASSETS SOLD AND SECURITIZED WITH RECOURSE OR OTHER SELLER-PROVIDED CREDIT ENHANCEMENTS - ALL OTHER LOANS
BHCKB712,RETAINED INTEREST-ONLY STRIPS - 1-4 FAMILY RESIDENTIAL LOANS
BHCKB713,RETAINED INTEREST-ONLY STRIPS - HOME EQUITY LINES
BHCKB714,RETAINED INTEREST-ONLY STRIPS - CREDIT CARD RECEIVABLES
BHCKB715,RETAINED INTEREST-ONLY STRIPS - AUTO LOANS
BHCKB716,RETAINED INTEREST-ONLY STRIPS - OTHER CONSUMER LOANS
BHCKB717,RETAINED INTEREST-ONLY STRIPS - COMMERCIAL AND INDUSTRIAL LOANS
BHCKB718,RETAINED INTEREST-ONLY STRIPS - ALL OTHER LOANS
BHCKB719,STANDBY LETTERS OF CREDIT; SUBORDINATED SECURITIES; AND OTHER ENHANCEMENTS - 1-4 FAMILY RESIDENTIAL LOANS
BHCKB720,STANDBY LETTERS OF CREDIT; SUBORDINATED SECURITIES; AND OTHER ENHANCEMENTS - HOME EQUITY LINES
BHCKB721,STANDBY LETTERS OF CREDIT; SUBORDINATED SECURITIES; AND OTHER ENHANCEMENTS - CREDIT CARD RECEIVABLES
BHCKB722,STANDBY LETTERS OF CREDIT; SUBORDINATED SECURITIES; AND OTHER ENHANCEMENTS - AUTO LOANS
BHCKB723,STANDBY LETTERS OF CREDIT; SUBORDINATED SECURITIES; AND OTHER ENHANCEMENTS - OTHER CONSUMER LOANS
BHCKB724,STANDBY LETTERS OF CREDIT; SUBORDINATED SECURITIES; AND OTHER ENHANCEMENTS - COMMERCIAL & INDUSTRIAL LOANS
BHCKB725,STANDBY LETTERS OF CREDIT; SUBORDINATED SECURITIES; AND OTHER ENHANCEMENTS - ALL OTHER LOANS
BHCKB726,REPORTING BANK'S UNUSED COMMITMENTS TO PROVIDE LIQUIDITY TO STRUCTURES REPORTED IN ITEM 1 - 1-4 FAMILY RESIDENTIAL LOANS
BHCKB727,REPORTING BANK'S UNUSED COMMITMENTS TO PROVIDE LIQUIDITY TO STRUCTURES REPORTED IN ITEM 1 - HOME EQUITY LINES
BHCKB728,REPORTING BANK'S UNUSED COMMITMENTS TO PROVIDE LIQUIDITY TO STRUCTURES REPORTED IN ITEM 1 - CREDIT CARD RECEIVABLES
BHCKB729,REPORTING BANK'S UNUSED COMMITMENTS TO PROVIDE LIQUIDITY TO STRUCTURES REPORTED IN ITEM 1 - AUTO LOANS
BHCKB730,REPORTING BANK'S UNUSED COMMITMENTS TO PROVIDE LIQUIDITY TO STRUCTURES REPORTED IN ITEM 1 - OTHER CONSUMER LOANS
BHCKB731,REPORTING BANK'S UNUSED COMMITMENTS TO PROVIDE LIQUIDITY TO STRUCTURES REPORTED IN ITEM 1 - COMMERCIAL AND INDUSTRIAL LOANS
BHCKB732,REPORTING BANK'S UNUSED COMMITMENTS TO PROVIDE LIQUIDITY TO STRUCTURES REPORTED IN ITEM 1 - ALL OTHER LOANS
BHCKB733,PAST DUE LOAN AMOUNTS INCLUDED IN ITEM 1: 30-89 DAY - 1-4 FAMILY RESIDENTIAL LOANS
BHCKB734,PAST DUE LOAN AMOUNTS INCLUDED IN ITEM 1: 30-89 DAYS - HOME EQUITY LINES
